query,discussion,help/instruction
roof and ground control,"Maintaining roof and ground stability is crucial in a coal mine. Discuss roof bolting, ground support, and monitoring techniques.","For roof and ground control: 1. Conduct regular roof and ground assessments. 2. Install roof bolts and ground support as needed. 3. Stay alert for signs of instability, such as roof sagging or ground heaving. 4. Report any concerns immediately."
dust control,"Dust control is essential for worker health and safety. Discuss methods to control dust levels, such as water sprays and ventilation systems.","To control dust levels: 1. Ensure proper ventilation to carry dust away. 2. Use water sprays to suppress dust where needed. 3. Wear appropriate respiratory protection if required. 4. Report any malfunctioning dust control equipment."
communication protocols,"Effective communication is vital in a coal mine. Discuss communication protocols, including radio use, signals, and emergency communication procedures.","For effective communication: 1. Familiarize yourself with the mine's communication protocols. 2. Use radios or communication devices according to guidelines. 3. Know emergency communication procedures. 4. Keep communication lines clear for emergency use."
injury reporting,"Reporting injuries promptly is crucial for medical attention and safety records. Discuss the procedure for reporting injuries and near-miss incidents.","When reporting injuries or incidents: 1. Seek immediate medical attention if injured. 2. Report injuries and near-miss incidents to your supervisor or safety officer. 3. Complete the required injury report forms accurately. 4. Cooperate with investigations as needed."
environmental regulations,"Coal mines must comply with environmental regulations. Discuss the importance of environmental compliance and measures in place.","To ensure environmental compliance: 1. Understand and follow environmental regulations. 2. Implement measures to minimize environmental impact, such as waste disposal. 3. Report any environmental concerns or violations to the appropriate authorities."
mining equipment operation,"Proper operation of mining equipment is essential for safety and productivity. Discuss safe equipment operation practices and potential hazards.","When operating mining equipment: 1. Be properly trained and certified for equipment operation. 2. Conduct pre-operation checks to ensure equipment is in good condition. 3. Follow safety procedures for starting, stopping, and maneuvering equipment. 4. Stay alert for potential hazards and report them."
safety measurements,"Safety measurements in a coal mine involve a variety of practices and protocols. These include: - Regular inspections of equipment - Proper ventilation to control gas buildup - Wearing appropriate safety gear - Training on emergency procedures\nRemember that safety is a top priority, and you should report any unsafe conditions immediately.","If you encounter a safety issue, follow these steps: 1. Alert your supervisor or a safety officer. 2. Evacuate the area if necessary. 3. Do not attempt to fix the issue yourself unless trained to do so. Safety is everyone's responsibility."
rules,"The rules in a coal mine are crucial for the safety and efficiency of operations. Some important rules include: - No smoking underground - Follow the designated escape routes - Observe weight limits on equipment - Report any accidents or injuries immediately\nCompliance with these rules is essential to prevent accidents and protect lives.","To ensure you follow the rules: 1. Familiarize yourself with the mine's safety handbook. 2. Attend safety training sessions regularly. 3. Be vigilant and report any rule violations."
gas,"Gas monitoring is essential in a coal mine to prevent explosions and ensure air quality. Common gases include methane and carbon monoxide. Gas-related discussions involve monitoring equipment, gas levels, and evacuation procedures.","If you detect unusual gas levels: 1. Immediately alert your team and supervisor. 2. Evacuate the area following designated escape routes. 3. Do not use any electrical equipment or open flames. 4. Wait for the all-clear signal from safety personnel."
emergency procedures,"In case of an emergency in the coal mine, quick and appropriate action is crucial. Discuss emergency procedures such as: - Evacuation plans - Communication protocols - First aid measures - Fire suppression methods","In case of an emergency: 1. Follow the evacuation plan and gather at the designated assembly point. 2. Use communication devices to report the emergency to the surface. 3. Administer first aid if trained. 4. Use fire suppression equipment if necessary."
equipment maintenance,"Regular maintenance of equipment in a coal mine is essential to prevent breakdowns and accidents. Discuss maintenance schedules, inspections, and reporting defects.","To ensure equipment reliability: 1. Follow the maintenance schedule provided. 2. Conduct daily pre-shift equipment inspections. 3. Report any defects or malfunctions immediately. 4. Do not attempt to use faulty equipment."
health and wellness,"The health and well-being of coal mine workers are important. Discuss topics like: - Proper nutrition and hydration - Stress management - Sleep and fatigue awareness - Exercise and physical fitness","To maintain good health and wellness: 1. Eat balanced meals and stay hydrated during shifts. 2. Manage stress through relaxation techniques. 3. Ensure adequate sleep and manage fatigue. 4. Incorporate regular exercise into your routine."
confined spaces,"Working in confined spaces in a coal mine can be hazardous. Discuss safety measures for confined space entry, including proper training and equipment.","When working in confined spaces: 1. Complete confined space entry training. 2. Use appropriate personal protective equipment (PPE). 3. Have a buddy system in place. 4. Follow confined space entry procedures."
hazardous materials,"Handling hazardous materials in a coal mine requires special precautions. Discuss the types of hazardous materials, storage, and emergency response plans.","When dealing with hazardous materials: 1. Identify and label containers properly. 2. Store materials in designated areas. 3. Know the location of emergency response equipment. 4. Follow spill response procedures."
accident protocol,"In case of an accident in the coal mine, following the proper protocol is crucial for the safety and well-being of all personnel. Discuss the accident protocol, including: - Immediate response steps - Emergency communication procedures - First aid measures - Reporting requirements\nIn the event of an accident: 1. Immediately assess the situation for safety hazards. 2. Provide first aid and medical attention to injured individuals if trained to do so. 3. Use communication devices to report the accident to the surface and emergency services. 4. Preserve the accident scene for investigation purposes. 5. Cooperate fully with accident investigations and reporting requirements."
